{
  "schemaVersion": 1,
  "project": "hardware",
  "recordedAt": "2026-10-19T07:28:33.146Z",
  "os": {
    "platform": "win32",
    "release": "10.0.26200",
    "version": "Windows 11 Pro",
    "arch": "x64"
  },
  "browser": {
    "name": "chromium",
    "channel": "msedge",
    "version": "155.0.4283.62",
    "headless": true,
    "launchArgs": [
      "--enable-unsafe-webgpu",
      "--ignore-gpu-blocklist",
      "--enable-webgpu-developer-features"
    ]
  },
  "userAgent": "Mozilla/5.0 (Windows NT 10.0; Win64; x64) AppleWebKit/537.36 (KHTML, like Gecko) HeadlessChrome/155.0.0.0 Safari/537.36 Edg/155.0.0.0",
  "devicePixelRatio": 1,
  "renderTargetSize": {
    "width": 128,
    "height": 128
  },
  "gpu": {
    "navigatorGpu": true,
    "reason": null,
    "adapter": {
      "info": {
        "vendor": "amd",
        "architecture": "rdna-3",
        "device": "0x744c",
        "description": "AMD Radeon RX 7900 XTX",
        "isFallbackAdapter": false
      },
      "adapterFeatures": [
        "atomic-vec2u-min-max",
        "bgra8unorm-storage",
        "chromium-experimental-multi-draw-indirect",
        "chromium-experimental-sampling-resource-table",
        "chromium-experimental-timestamp-query-inside-passes",
        "clip-distances",
        "core-features-and-limits",
        "depth-clip-control",
        "depth32float-stencil8",
        "dual-source-blending",
        "float32-blendable",
        "float32-filterable",
        "indirect-first-instance",
        "primitive-index",
        "rg11b10ufloat-renderable",
        "shader-f16",
        "subgroup-size-control",
        "subgroups",
        "texture-component-swizzle",
        "texture-compression-bc",
        "texture-compression-bc-sliced-3d",
        "texture-compression-unaligned",
        "texture-formats-tier1",
        "texture-formats-tier2",
        "timestamp-query"
      ],
      "deviceFeatures": [
        "core-features-and-limits"
      ],
      "limits": {
        "maxTextureDimension2D": 16384,
        "maxBindGroups": 4,
        "maxBindingsPerBindGroup": 1000,
        "maxUniformBufferBindingSize": 65536,
        "maxStorageBufferBindingSize": 2147483644,
        "minUniformBufferOffsetAlignment": 256,
        "minStorageBufferOffsetAlignment": 256,
        "maxBufferSize": 2147483648,
        "maxVertexBuffers": 8,
        "maxVertexAttributes": 30,
        "maxColorAttachments": 8,
        "maxColorAttachmentBytesPerSample": 128,
        "maxComputeInvocationsPerWorkgroup": 1024,
        "maxComputeWorkgroupSizeX": 1024,
        "maxComputeWorkgroupSizeY": 1024,
        "maxComputeWorkgroupSizeZ": 64,
        "maxComputeWorkgroupsPerDimension": 65535
      }
    },
    "wgslLanguageFeatures": [
      "buffer_view",
      "immediate_address_space",
      "linear_indexing",
      "packed_4x8_integer_dot_product",
      "pointer_composite_access",
      "readonly_and_readwrite_storage_textures",
      "subgroup_id",
      "subgroup_uniformity",
      "swizzle_assignment",
      "texture_and_sampler_let",
      "texture_formats_tier1",
      "uniform_buffer_standard_layout",
      "unrestricted_pointer_parameters"
    ]
  },
  "source": {
    "gitCommit": "7cf7ce9029e0d0b13e4c1e3e483c3dd26b3a466e",
    "gitDirty": false
  },
  "toolchain": {
    "rustc": "rustc 1.99.0 (b940084d7 2026-09-28)",
    "naga": "30.0.1",
    "node": "v24.18.1",
    "playwright": "1.63.0",
    "runtimeWeb": "0.1.0-dev"
  },
  "settings": {
    "requireGpu": true,
    "acceptSoftware": false
  }
}
