{
  "schemaVersion": 1,
  "project": "software",
  "recordedAt": "2026-10-19T01:37:43.152Z",
  "os": {
    "platform": "linux",
    "release": "6.17.0-1022-azure",
    "version": "#22-Ubuntu SMP Mon Jul 27 17:24:03 UTC 2026",
    "arch": "x64"
  },
  "browser": {
    "name": "chromium",
    "channel": "chromium",
    "version": "153.0.8010.12",
    "headless": true,
    "launchArgs": [
      "--enable-unsafe-webgpu",
      "--use-webgpu-adapter=swiftshader",
      "--enable-webgpu-developer-features",
      "--enable-features=Vulkan",
      "--use-vulkan=swiftshader"
    ]
  },
  "userAgent": "Mozilla/5.0 (X11; Linux x86_64) AppleWebKit/537.36 (KHTML, like Gecko) HeadlessChrome/153.0.0.0 Safari/537.36",
  "devicePixelRatio": 1,
  "renderTargetSize": {
    "width": 128,
    "height": 128
  },
  "gpu": {
    "navigatorGpu": true,
    "reason": null,
    "adapter": {
      "info": {
        "vendor": "google",
        "architecture": "swiftshader",
        "device": "0xc0de",
        "description": "SwiftShader Device (Subzero)",
        "isFallbackAdapter": true
      },
      "adapterFeatures": [
        "bgra8unorm-storage",
        "chromium-experimental-sampling-resource-table",
        "chromium-experimental-timestamp-query-inside-passes",
        "clip-distances",
        "core-features-and-limits",
        "depth-clip-control",
        "depth32float-stencil8",
        "float32-blendable",
        "float32-filterable",
        "indirect-first-instance",
        "rg11b10ufloat-renderable",
        "subgroup-size-control",
        "subgroups",
        "texture-component-swizzle",
        "texture-compression-astc",
        "texture-compression-astc-sliced-3d",
        "texture-compression-bc",
        "texture-compression-bc-sliced-3d",
        "texture-compression-etc2",
        "texture-compression-unaligned",
        "timestamp-query"
      ],
      "deviceFeatures": [
        "core-features-and-limits"
      ],
      "limits": {
        "maxTextureDimension2D": 8192,
        "maxBindGroups": 4,
        "maxBindingsPerBindGroup": 1000,
        "maxUniformBufferBindingSize": 65536,
        "maxStorageBufferBindingSize": 1073741824,
        "minUniformBufferOffsetAlignment": 256,
        "minStorageBufferOffsetAlignment": 256,
        "maxBufferSize": 1073741824,
        "maxVertexBuffers": 8,
        "maxVertexAttributes": 16,
        "maxColorAttachments": 8,
        "maxColorAttachmentBytesPerSample": 128,
        "maxComputeInvocationsPerWorkgroup": 256,
        "maxComputeWorkgroupSizeX": 256,
        "maxComputeWorkgroupSizeY": 256,
        "maxComputeWorkgroupSizeZ": 64,
        "maxComputeWorkgroupsPerDimension": 65535
      }
    },
    "wgslLanguageFeatures": [
      "buffer_view",
      "immediate_address_space",
      "linear_indexing",
      "packed_4x8_integer_dot_product",
      "pointer_composite_access",
      "readonly_and_readwrite_storage_textures",
      "subgroup_id",
      "subgroup_uniformity",
      "swizzle_assignment",
      "texture_and_sampler_let",
      "texture_formats_tier1",
      "uniform_buffer_standard_layout",
      "unrestricted_pointer_parameters"
    ]
  },
  "source": {
    "gitCommit": "c588dd314fbf27f7a8753b77cd45cf8168beddd0",
    "gitDirty": false
  },
  "toolchain": {
    "rustc": "rustc 1.99.0 (b940084d7 2026-09-28)",
    "naga": "30.0.1",
    "node": "v24.21.0",
    "playwright": "1.63.0",
    "runtimeWeb": "0.1.0-dev"
  },
  "settings": {
    "requireGpu": false,
    "acceptSoftware": false
  }
}
